{
  "review_version": "1",
  "verdict": "block",
  "risk_class": "HIGH",
  "diff_sha256": "0000000000000000000000000000000000000000000000000000000000000000",
  "summary": "Review blocks because a required proof artifact is missing.",
  "findings": [
    {
      "id": "F1",
      "severity": "HIGH",
      "evidence_ref": "missing-test:validator-negative-path",
      "reason": "The change claims validation but has no negative-path proof.",
      "minimal_fix": "Add a failing fixture and prove the validator rejects it."
    }
  ],
  "evidence_gaps": [
    {
      "what": "validator rejection proof",
      "verification_requested": "Run validate_review.py against a malformed verdict and capture the non-zero exit."
    }
  ],
  "another_loop_required": true,
  "non_blocking_notes": []
}
