{
  "review_version": "1",
  "verdict": "approve",
  "risk_class": "LOW",
  "diff_sha256": "0000000000000000000000000000000000000000000000000000000000000000",
  "summary": "Focused change is verified and has no blocking findings.",
  "findings": [],
  "evidence_gaps": [],
  "another_loop_required": false,
  "non_blocking_notes": [
    {
      "note": "Run broader CI before merge if the touched surface is CI-gated.",
      "why_non_blocking": "Local verification already covers the reviewed contract."
    }
  ]
}
